[
  {
    "attribution": {
      "required": true,
      "text": "Hexagon Imagery",
      "url": "https://hexagon.com/products/aerial-imagery"
    },
    "description": "Hexagon Imagery for Washington state in USA",
    "extent": {
      "max_zoom": 19,
      "polygon": [
        [
          [
            -124.84,
            48.99
          ],
          [
            -124.78,
            47.46
          ],
          [
            -124.70,
            47.15
          ],
          [
            -124.47,
            46.95
          ],
          [
            -124.15,
            46.75
          ],
          [
            -124.05,
            46.28
          ],
          [
            -124.05,
            45.94
          ],
          [
            -122.40,
            45.94
          ],
          [
            -122.30,
            46.00
          ],
          [
            -121.50,
            45.67
          ],
          [
            -120.50,
            45.70
          ],
          [
            -119.90,
            46.05
          ],
          [
            -118.99,
            46.28
          ],
          [
            -117.03,
            46.34
          ],
          [
            -117.04,
            47.76
          ],
          [
            -117.05,
            49.00
          ],
          [
            -118.70,
            49.00
          ],
          [
            -120.00,
            49.00
          ],
          [
            -122.76,
            49.00
          ],
          [
            -124.84,
            48.99
          ]
        ]
      ]
    },
    "icon": "https://ichs-p-001.sitecorecontenthub.cloud/api/public/content/a-s-s-e-t---3-9-4-2-4-39424?v=ba59b6e9",
    "id": "HX_IMG",
    "name": "Hexagon Imagery",
    "type": "wmts",
    "url": "https://waprovisoimg.centralindia.cloudapp.azure.com/streaming/wmts?/1.0.0/HxGN_Imagery/default/WebMercator/{z}/{y}/{x}.png"
  }
]
